{
  "$schema": "https://json-schema.org/draft/2020-12/schema",
  "$id": "https://deddal.app/schemas/seed-data/algorithms.json",
  "title": "Algorithms Seed Data Schema",
  "description": "JSON Schema for Rubik's Cube algorithm seed data files (seeddata_algorithms_*.json). Each algorithm represents a move sequence for solving a specific method case. Each case typically has multiple algorithm options with different characteristics.",
  "type": "array",
  "items": {
    "type": "object",
    "required": ["id", "case_id", "code", "sequence"],
    "additionalProperties": false,
    "properties": {
      "id": {
        "type": "string",
        "pattern": "^[0-9a-fA-F]{8}-[0-9a-fA-F]{4}-[0-9a-fA-F]{4}-[0-9a-fA-F]{4}-[0-9a-fA-F]{12}$",
        "description": "Unique identifier (UUID v4)"
      },
      "case_id": {
        "type": "string",
        "pattern": "^[0-9a-fA-F]{8}-[0-9a-fA-F]{4}-[0-9a-fA-F]{4}-[0-9a-fA-F]{4}-[0-9a-fA-F]{12}$",
        "description": "Foreign key reference to cases table (which case this algorithm solves). Must reference an existing case."
      },
      "code": {
        "type": "string",
        "minLength": 1,
        "description": "Unique code identifier for the algorithm within its case (e.g., 'ua-1', 'ua-2', 't-perm-standard', 'CLL-U-01-01')",
        "examples": ["ua-1", "t-perm-standard", "CLL-U-01-01", "oll-21-fast"]
      },
      "sequence": {
        "type": "string",
        "description": "Move notation sequence for the algorithm. Empty string allowed for 'Skip' cases where no moves needed. Uses standard Rubik's Cube notation: R, L, U, D, F, B (and their primes/doubles)",
        "examples": [
          "",
          "R U R' U'",
          "R U R' U' R' F R2 U' R' U' R U R' F'",
          "M2 U M2 U2 M2 U M2"
        ]
      },
      "name": {
        "type": ["string", "null"],
        "description": "Optional human-readable name for the algorithm (e.g., 'Sune', 'T Perm', 'Sexy Move')",
        "examples": ["Sune", "T Perm", "Sexy Move", "Standard Algorithm", "Fast Algorithm"]
      },
      "tags": {
        "type": ["array", "null"],
        "description": "Classification tags for the algorithm (e.g., characteristics, fingertrick styles, speed ratings)",
        "items": {
          "type": "string",
          "minLength": 1,
          "description": "Tag describing algorithm characteristic"
        },
        "examples": [
          ["fast", "M-slice", "standard"],
          ["fingertrick-heavy", "beginner-friendly"],
          ["two-look", "advanced"]
        ]
      },
      "popularity": {
        "type": ["integer", "null"],
        "minimum": 0,
        "maximum": 100,
        "description": "Popularity score from 0 (least popular) to 100 (most popular). Default is 50 if not specified.",
        "default": 50,
        "examples": [25, 50, 85]
      },
      "difficulty": {
        "type": ["integer", "null"],
        "minimum": 1,
        "maximum": 5,
        "description": "Difficulty rating from 1 (easiest) to 5 (hardest)",
        "examples": [1, 3, 5]
      },
      "avg_moves": {
        "type": ["integer", "null"],
        "minimum": 1,
        "description": "Average number of moves in the algorithm (Quarter Turn Metric or similar)",
        "examples": [4, 12, 17]
      },
      "avg_execution_time_ms": {
        "type": ["integer", "null"],
        "minimum": 1,
        "description": "Average execution time in milliseconds for experienced cubers",
        "examples": [800, 1200, 2000]
      },
      "story": {
        "type": ["string", "null"],
        "description": "Educational content for algorithm execution tips, fingertricks, recognition aids, or mnemonics"
      },
      "created_at": {
        "type": ["string", "null"],
        "format": "date-time",
        "description": "Creation timestamp in ISO 8601 format with timezone",
        "examples": ["2025-01-10T00:00:00.000Z"]
      }
    }
  },
  "minItems": 1,
  "description": "Array must contain at least one algorithm"
}
