[
  {"id": "56d95479-d99b-555e-9d23-ab14015f56ef", "case_id": "d79ed577-3406-5568-8aee-f297c5274411", "code": "3X3-PELL-H-01", "sequence": "M2' U M2' U2' M2' U M2'", "name": "H Perm", "tags": null, "popularity": 85, "difficulty": 3, "avg_moves": null, "avg_execution_time_ms": null, "story": null, "created_at": "2025-11-09T00:00:00+00:00"},
  {"id": "669f45a2-4508-5b93-b54a-3306a374fbf2", "case_id": "d79ed577-3406-5568-8aee-f297c5274411", "code": "3X3-PELL-H-02", "sequence": "M2' U' M2' U2' M2' U' M2'", "name": "H Perm Alt", "tags": null, "popularity": 70, "difficulty": 3, "avg_moves": null, "avg_execution_time_ms": null, "story": null, "created_at": "2025-11-09T00:00:00+00:00"},
  {"id": "a49e7d45-c762-51eb-9e58-418d07283377", "case_id": "8949167c-4de1-5547-90a0-fd8f7d7947d2", "code": "3X3-PELL-UA-01", "sequence": "R U' R U R U R U' R' U' R2", "name": "Ua Perm", "tags": null, "popularity": 100, "difficulty": 3, "avg_moves": null, "avg_execution_time_ms": null, "story": null, "created_at": "2025-11-09T00:00:00+00:00"},
  {"id": "d4ddcb0c-8e88-5edf-9a72-4fd7a6c6fa79", "case_id": "8949167c-4de1-5547-90a0-fd8f7d7947d2", "code": "3X3-PELL-UA-02", "sequence": "M2' U M U2' M' U M2'", "name": "Ua Perm Alt", "tags": null, "popularity": 85, "difficulty": 3, "avg_moves": null, "avg_execution_time_ms": null, "story": null, "created_at": "2025-11-09T00:00:00+00:00"},
  {"id": "230610f1-4aca-51af-8c23-0d362a8d886c", "case_id": "d22cc76f-444b-539e-bf50-8931d124d60f", "code": "3X3-PELL-UB-01", "sequence": "R2' U R U R' U' R' U' R' U R'", "name": "Ub Perm", "tags": null, "popularity": 100, "difficulty": 3, "avg_moves": null, "avg_execution_time_ms": null, "story": null, "created_at": "2025-11-09T00:00:00+00:00"},
  {"id": "544f9806-c5a0-53fb-920e-620139475adf", "case_id": "d22cc76f-444b-539e-bf50-8931d124d60f", "code": "3X3-PELL-UB-02", "sequence": "M2' U' M U2' M' U' M2'", "name": "Ub Perm Alt", "tags": null, "popularity": 85, "difficulty": 3, "avg_moves": null, "avg_execution_time_ms": null, "story": null, "created_at": "2025-11-09T00:00:00+00:00"},
  {"id": "325e022e-6cc8-55cb-bb91-a65b420a3892", "case_id": "707cea01-2868-52e6-b5fb-13ecc8bc2e4a", "code": "3X3-PELL-Z-01", "sequence": "M' U M2' U M2' U M' U2' M2'", "name": "Z Perm", "tags": null, "popularity": 90, "difficulty": 4, "avg_moves": null, "avg_execution_time_ms": null, "story": null, "created_at": "2025-11-09T00:00:00+00:00"},
  {"id": "3fe6eeaf-58d6-5474-959b-679c113dc02f", "case_id": "707cea01-2868-52e6-b5fb-13ecc8bc2e4a", "code": "3X3-PELL-Z-02", "sequence": "M2' U M2' U M' U2' M2' U2' M'", "name": "Z Perm Alt", "tags": null, "popularity": 75, "difficulty": 4, "avg_moves": null, "avg_execution_time_ms": null, "story": null, "created_at": "2025-11-09T00:00:00+00:00"}
]