[
  {"id": "81ee677b-9c9d-5557-80e7-94ebeacf47d0", "case_id": "7c0fa2ff-ecc8-5280-90c6-e6980e439397", "code": "OeLL-Dot-01", "sequence": "F (R U R' U') F' f (R U R' U') f'", "name": "Two-Step Dot Algorithm", "tags": null, "popularity": 100, "difficulty": 4, "avg_moves": null, "avg_execution_time_ms": null, "story": null, "created_at": "2025-11-09T00:00:00.000Z"},
  {"id": "4cc0a48e-2d6a-5647-a093-c8b0636b1ccb", "case_id": "38e4ae9c-99c0-5e79-8e89-1a4e68045417", "code": "OeLL-L-01", "sequence": "f (R U R' U') f'", "name": "Standard L-Shape Algorithm", "tags": null, "popularity": 100, "difficulty": 2, "avg_moves": null, "avg_execution_time_ms": null, "story": null, "created_at": "2025-11-09T00:00:00.000Z"},
  {"id": "40a3b606-4cb7-5f3e-9478-52e433457fb9", "case_id": "4caf1181-bb2b-5fd2-a119-44e79e853b63", "code": "OeLL-Line-01", "sequence": "F (R U R' U') F'", "name": "Standard Line Algorithm", "tags": null, "popularity": 100, "difficulty": 2, "avg_moves": null, "avg_execution_time_ms": null, "story": null, "created_at": "2025-11-09T00:00:00.000Z"}
]