[
  {
    "id": "0e83257c-08c1-5912-af08-203d88bf90ec",
    "case_id": "29a261a9-bd02-51d5-b12a-ae0913bcb32c",
    "code": "4x4-OLL-PARITY-01",
    "sequence": "r2 B2 U2 l U2 r' U2 r U2 F2 r F2 l' B2 r2",
    "name": "Standard OLL Parity Fix",
    "tags": [
      "parity",
      "oll",
      "4x4",
      "standard"
    ],
    "popularity": 100,
    "difficulty": 4,
    "avg_moves": null,
    "avg_execution_time_ms": null,
    "story": null,
    "created_at": "2025-12-02T00:00:00.000Z"
  },
  {
    "id": "d1cd3b9d-ba40-5287-8f69-79ce30d72b21",
    "case_id": "29a261a9-bd02-51d5-b12a-ae0913bcb32c",
    "code": "4x4-OLL-PARITY-02",
    "sequence": "Rw U2 x Rw U2 Rw U2 Rw' U2 Lw U2 Rw' U2 Rw U2 Rw' U2 Rw'",
    "name": "Alternative OLL Parity (Rw notation)",
    "tags": [
      "parity",
      "oll",
      "4x4",
      "alternative"
    ],
    "popularity": 85,
    "difficulty": 4,
    "avg_moves": null,
    "avg_execution_time_ms": null,
    "story": null,
    "created_at": "2025-12-02T00:00:00.000Z"
  }
]