[
  {"id": "b17719ef-d4b9-5302-acb4-5daee9366dce", "case_id": "4b400596-f9a9-5dce-b69f-786cb28ea8e5", "code": "OcLL-Sune-01", "sequence": "R U R' U R U2' R'", "name": "Sune", "tags": null, "popularity": 100, "difficulty": 2, "avg_moves": null, "avg_execution_time_ms": null, "story": null, "created_at": "2025-11-09T00:00:00.000Z"},
  {"id": "e417bbbe-1234-56d5-a47e-e6678bf7bc47", "case_id": "95f41767-b0a2-54ef-a640-c40dd6106cdb", "code": "OcLL-Antisune-01", "sequence": "R U2' R' U' R U' R'", "name": "Antisune", "tags": null, "popularity": 100, "difficulty": 2, "avg_moves": null, "avg_execution_time_ms": null, "story": null, "created_at": "2025-11-09T00:00:00.000Z"},
  {"id": "4e77dd76-cc33-53d5-b640-67484f9fce95", "case_id": "cc774d90-91bb-5dd3-bbef-5e267aac4e69", "code": "OcLL-Pi-01", "sequence": "R U2' R2' U' R2 U' R2' U2' R", "name": "Pi Case Algorithm", "tags": null, "popularity": 90, "difficulty": 3, "avg_moves": null, "avg_execution_time_ms": null, "story": null, "created_at": "2025-11-09T00:00:00.000Z"},
  {"id": "0eb9f207-8d1c-5003-ad97-bc07d46570b4", "case_id": "d5635e93-c473-55a9-83a5-239d2182b4d1", "code": "OcLL-H-01", "sequence": "R U2' R' U' R U R' U' R U' R'", "name": "H Case Algorithm", "tags": null, "popularity": 90, "difficulty": 3, "avg_moves": null, "avg_execution_time_ms": null, "story": null, "created_at": "2025-11-09T00:00:00.000Z"},
  {"id": "e6863a0e-2048-5411-afd4-9984d7b1e29c", "case_id": "bed5663f-850f-5769-ae84-d75e6e009d37", "code": "OcLL-T-01", "sequence": "r U R' U' r' F R F'", "name": "T Case Algorithm", "tags": null, "popularity": 85, "difficulty": 3, "avg_moves": null, "avg_execution_time_ms": null, "story": null, "created_at": "2025-11-09T00:00:00.000Z"},
  {"id": "fac29091-bda2-5924-85e1-d265befbd03e", "case_id": "ba5ffad8-8c3d-5f72-9196-31d4a46a860b", "code": "OcLL-U-01", "sequence": "R2' D' R U2' R' D R U2' R", "name": "U Case Algorithm", "tags": null, "popularity": 85, "difficulty": 3, "avg_moves": null, "avg_execution_time_ms": null, "story": null, "created_at": "2025-11-09T00:00:00.000Z"},
  {"id": "b8b8a2e1-6cdd-58d3-9484-f345d5f58d87", "case_id": "4bd41d86-d5c1-5d91-8892-2f4f6ad8c016", "code": "OcLL-L-01", "sequence": "F R' F' r U R U' r'", "name": "L Case Algorithm", "tags": null, "popularity": 80, "difficulty": 3, "avg_moves": null, "avg_execution_time_ms": null, "story": null, "created_at": "2025-11-09T00:00:00.000Z"}
]