[
  {"id": "31becb66-7666-459e-99f8-9c6745c11c18", "case_id": "e0111111-1111-1111-1111-111111111111", "code": "LSE-EO01-01", "sequence": "", "name": "Skip", "tags": null, "popularity": 100, "difficulty": null, "avg_moves": null, "avg_execution_time_ms": null, "story": null, "created_at": "2025-12-18T15:52:33.025492+00:00"},
  {"id": "b7b2348c-c2e8-4dc4-a034-ab1d74f9333f", "case_id": "e0222222-2222-2222-2222-222222222222", "code": "LSE-EO02-01", "sequence": "M' U M", "name": "Standard", "tags": null, "popularity": 95, "difficulty": null, "avg_moves": null, "avg_execution_time_ms": null, "story": null, "created_at": "2025-12-18T15:52:33.025492+00:00"},
  {"id": "ba26c687-8853-406a-a57f-b104b5915cae", "case_id": "e0333333-3333-3333-3333-333333333333", "code": "LSE-EO03-01", "sequence": "M U M'", "name": "Standard", "tags": null, "popularity": 95, "difficulty": null, "avg_moves": null, "avg_execution_time_ms": null, "story": null, "created_at": "2025-12-18T15:52:33.025492+00:00"},
  {"id": "7ae2920d-8f34-47c9-a052-1f1d684ac0e0", "case_id": "e0444444-4444-4444-4444-444444444444", "code": "LSE-EO04-01", "sequence": "M2 U' M' U' M'", "name": "Standard", "tags": null, "popularity": 80, "difficulty": null, "avg_moves": null, "avg_execution_time_ms": null, "story": null, "created_at": "2025-12-18T15:52:33.025492+00:00"},
  {"id": "e2786b6a-4e50-4112-b881-6b50b53882c6", "case_id": "e0555555-5555-5555-5555-555555555555", "code": "LSE-EO05-01", "sequence": "M U' M' U' M U' M'", "name": "Standard", "tags": null, "popularity": 75, "difficulty": null, "avg_moves": null, "avg_execution_time_ms": null, "story": null, "created_at": "2025-12-18T15:52:33.025492+00:00"},
  {"id": "0e1896c7-3fb6-48d3-97d7-d1fe8b305d70", "case_id": "e0555555-5555-5555-5555-555555555555", "code": "LSE-EO05-02", "sequence": "M U M' U M U M'", "name": "Alternative", "tags": null, "popularity": 65, "difficulty": null, "avg_moves": null, "avg_execution_time_ms": null, "story": null, "created_at": "2025-12-18T15:52:33.025492+00:00"},
  {"id": "ce39007b-f27e-4fe2-86ca-197075d5e629", "case_id": "e0666666-6666-6666-6666-666666666666", "code": "LSE-EO06-01", "sequence": "M' U' M U' M' U' M'", "name": "Standard", "tags": null, "popularity": 75, "difficulty": null, "avg_moves": null, "avg_execution_time_ms": null, "story": null, "created_at": "2025-12-18T15:52:33.025492+00:00"},
  {"id": "ec9caf57-c17b-4ed5-945a-a3666ccf1a89", "case_id": "e0666666-6666-6666-6666-666666666666", "code": "LSE-EO06-02", "sequence": "M' U M U M' U M", "name": "Alternative", "tags": null, "popularity": 65, "difficulty": null, "avg_moves": null, "avg_execution_time_ms": null, "story": null, "created_at": "2025-12-18T15:52:33.025492+00:00"},
  {"id": "42738a83-ae82-479c-9b38-8b098579f543", "case_id": "e0777777-7777-7777-7777-777777777777", "code": "LSE-EO07-01", "sequence": "M' U' M' U2 M' U' M'", "name": "Standard", "tags": null, "popularity": 70, "difficulty": null, "avg_moves": null, "avg_execution_time_ms": null, "story": null, "created_at": "2025-12-18T15:52:33.025492+00:00"},
  {"id": "fc15f7b7-be1f-4219-9056-d379b274fb0d", "case_id": "e0888888-8888-8888-8888-888888888888", "code": "LSE-EO08-01", "sequence": "M' U2 M' U2 M U' M'", "name": "Standard", "tags": null, "popularity": 70, "difficulty": null, "avg_moves": null, "avg_execution_time_ms": null, "story": null, "created_at": "2025-12-18T15:52:33.025492+00:00"},
  {"id": "d3090494-d2fd-45e6-ba83-b398e419323d", "case_id": "e0999999-9999-9999-9999-999999999999", "code": "LSE-EO09-01", "sequence": "M' U' M U M' U' M'", "name": "Standard", "tags": null, "popularity": 65, "difficulty": null, "avg_moves": null, "avg_execution_time_ms": null, "story": null, "created_at": "2025-12-18T15:52:33.025492+00:00"},
  {"id": "b45c9e7e-0856-42bb-9d3c-84e2f2f01a69", "case_id": "e0aaaaaa-aaaa-aaaa-aaaa-aaaaaaaaaaaa", "code": "LSE-EO10-01", "sequence": "M' U' M' U2 M' U' M U' M' U' M'", "name": "Standard", "tags": null, "popularity": 50, "difficulty": null, "avg_moves": null, "avg_execution_time_ms": null, "story": null, "created_at": "2025-12-18T15:52:33.025492+00:00"}
]