[
  {
    "id": "02a2b2c2-d2e2-f2a2-b2c2-d2e2f2a2b2c2",
    "case_id": "b2c3d4e5-f6a7-8901-bcde-f12345678901",
    "code": "2X2-ORTEGA-OLL-2-01",
    "sequence": "R U2 R' U' R U' R'",
    "name": "Standard Anti-Sune",
    "tags": [
      "standard"
    ],
    "popularity": 95,
    "difficulty": 1,
    "avg_moves": 7,
    "avg_execution_time_ms": null,
    "story": null,
    "created_at": "2025-01-10T00:00:00.000Z"
  },
  {
    "id": "01a1b1c1-d1e1-f1a1-b1c1-d1e1f1a1b1c1",
    "case_id": "a1b2c3d4-e5f6-7890-abcd-ef1234567890",
    "code": "2X2-ORTEGA-OLL-1-01",
    "sequence": "R U R' U R U2 R'",
    "name": "Standard Sune",
    "tags": [
      "standard"
    ],
    "popularity": 95,
    "difficulty": 1,
    "avg_moves": 7,
    "avg_execution_time_ms": null,
    "story": null,
    "created_at": "2025-01-10T00:00:00.000Z"
  },
  {
    "id": "05a5b5c5-d5e5-f5a5-b5c5-d5e5f5a5b5c5",
    "case_id": "e5f6a7b8-c9d0-1234-ef12-345678901234",
    "code": "2X2-ORTEGA-OLL-5-01",
    "sequence": "R U R' U' R' F R F'",
    "name": "Standard T",
    "tags": [
      "standard"
    ],
    "popularity": 90,
    "difficulty": 2,
    "avg_moves": 8,
    "avg_execution_time_ms": null,
    "story": null,
    "created_at": "2025-01-10T00:00:00.000Z"
  },
  {
    "id": "03a3b3c3-d3e3-f3a3-b3c3-d3e3f3a3b3c3",
    "case_id": "c3d4e5f6-a7b8-9012-cdef-123456789012",
    "code": "2X2-ORTEGA-OLL-3-01",
    "sequence": "F R U R' U' F'",
    "name": "Standard U",
    "tags": [
      "standard"
    ],
    "popularity": 90,
    "difficulty": 1,
    "avg_moves": 6,
    "avg_execution_time_ms": null,
    "story": null,
    "created_at": "2025-01-10T00:00:00.000Z"
  },
  {
    "id": "06a6b6c6-d6e6-f6a6-b6c6-d6e6f6a6b6c6",
    "case_id": "f6a7b8c9-d0e1-2345-f123-456789012345",
    "code": "2X2-ORTEGA-OLL-6-01",
    "sequence": "R2 U2 R U2 R2",
    "name": "Standard H (Version 1)",
    "tags": [
      "standard"
    ],
    "popularity": 90,
    "difficulty": 1,
    "avg_moves": 5,
    "avg_execution_time_ms": null,
    "story": null,
    "created_at": "2025-01-10T00:00:00.000Z"
  },
  {
    "id": "07a7b7c7-d7e7-f7a7-b7c7-d7e7f7a7b7c7",
    "case_id": "a7b8c9d0-e1f2-3456-a123-567890123456",
    "code": "2X2-ORTEGA-OLL-7-01",
    "sequence": "F R U' R' U' R U R' F'",
    "name": "Standard L (Right)",
    "tags": [
      "standard"
    ],
    "popularity": 85,
    "difficulty": 2,
    "avg_moves": 9,
    "avg_execution_time_ms": null,
    "story": null,
    "created_at": "2025-01-10T00:00:00.000Z"
  },
  {
    "id": "04a4b4c4-d4e4-f4a4-b4c4-d4e4f4a4b4c4",
    "case_id": "d4e5f6a7-b8c9-0123-def1-234567890123",
    "code": "2X2-ORTEGA-OLL-4-01",
    "sequence": "F R U R' U' R U R' U' F'",
    "name": "Standard Pi",
    "tags": [
      "standard"
    ],
    "popularity": 85,
    "difficulty": 2,
    "avg_moves": 10,
    "avg_execution_time_ms": null,
    "story": null,
    "created_at": "2025-01-10T00:00:00.000Z"
  },
  {
    "id": "06a6b6c6-d6e6-f6a6-b6c6-d6e6f6a6b6c7",
    "case_id": "f6a7b8c9-d0e1-2345-f123-456789012345",
    "code": "2X2-ORTEGA-OLL-6-02",
    "sequence": "R2 U2 R' U2 R2",
    "name": "Standard H (Version 2)",
    "tags": [
      "alternative"
    ],
    "popularity": 75,
    "difficulty": 1,
    "avg_moves": 5,
    "avg_execution_time_ms": null,
    "story": null,
    "created_at": "2025-01-10T00:00:00.000Z"
  },
  {
    "id": "07a7b7c7-d7e7-f7a7-b7c7-d7e7f7a7b7c8",
    "case_id": "a7b8c9d0-e1f2-3456-a123-567890123456",
    "code": "2X2-ORTEGA-OLL-7-02",
    "sequence": "y F' R U R' U' R' F R [y']",
    "name": "Alternative L (Left)",
    "tags": [
      "alternative"
    ],
    "popularity": 70,
    "difficulty": 2,
    "avg_moves": 9,
    "avg_execution_time_ms": null,
    "story": null,
    "created_at": "2025-01-10T00:00:00.000Z"
  },
  {
    "id": "05a5b5c5-d5e5-f5a5-b5c5-d5e5f5a5b5c6",
    "case_id": "e5f6a7b8-c9d0-1234-ef12-345678901234",
    "code": "2X2-ORTEGA-OLL-5-02",
    "sequence": "F R U R' U' F'",
    "name": "Alternative T",
    "tags": [
      "alternative"
    ],
    "popularity": 60,
    "difficulty": 1,
    "avg_moves": 6,
    "avg_execution_time_ms": null,
    "story": null,
    "created_at": "2025-01-10T00:00:00.000Z"
  },
  {
    "id": "04a4b4c4-d4e4-f4a4-b4c4-d4e4f4a4b4c5",
    "case_id": "d4e5f6a7-b8c9-0123-def1-234567890123",
    "code": "2X2-ORTEGA-OLL-4-02",
    "sequence": "R U2 R2 U' R2 U' R2 U2 R",
    "name": "Alternative Pi",
    "tags": [
      "alternative"
    ],
    "popularity": 55,
    "difficulty": 2,
    "avg_moves": 9,
    "avg_execution_time_ms": null,
    "story": null,
    "created_at": "2025-01-10T00:00:00.000Z"
  },
  {
    "id": "06a6b6c6-d6e6-f6a6-b6c6-d6e6f6a6b6c8",
    "case_id": "f6a7b8c9-d0e1-2345-f123-456789012345",
    "code": "2X2-ORTEGA-OLL-6-03",
    "sequence": "F2 U2 F U2 F2",
    "name": "F2 H",
    "tags": [
      "alternative"
    ],
    "popularity": 50,
    "difficulty": 1,
    "avg_moves": 5,
    "avg_execution_time_ms": null,
    "story": null,
    "created_at": "2025-01-10T00:00:00.000Z"
  },
  {
    "id": "03a3b3c3-d3e3-f3a3-b3c3-d3e3f3a3b3c4",
    "case_id": "c3d4e5f6-a7b8-9012-cdef-123456789012",
    "code": "2X2-ORTEGA-OLL-3-02",
    "sequence": "F' L' U' L U F",
    "name": "Mirror U",
    "tags": [
      "alternative"
    ],
    "popularity": 50,
    "difficulty": 1,
    "avg_moves": 6,
    "avg_execution_time_ms": null,
    "story": null,
    "created_at": "2025-01-10T00:00:00.000Z"
  }
]